Filename,Reference Text,Transcribed Text,wer,wer c
common_voice_he_39753491,"הָלַכְנוּ, הִסְתַּכַּלְנוּ בַּטֶּבַע הַיָּפָה עַד שֶׁהִגַּעְנוּ לַמּוֹרָד.",הלכנו הסתכלנו בטבע היפה עד שהגענו למורד.,1,0
common_voice_he_39753587,לַמָתַי עָלֶיךָ לִהְיוֹת מוּכָן לַבְּחִינוֹת?,למתי עליך להיות מוכן לבחינות?,1,0
common_voice_he_39753650,בְּאַחַד הַיָּמִים יָצָא הַקָּצִין.,באחד הימים יצא הקצין,1,0
common_voice_he_39771261,זֶה הָיָה מַשְׁדֵּר.,זה היה משדר.,1,0
common_voice_he_39778670,"הַאִם כְּבָר חָלַף מֵהָעוֹלָם שִׁלְטוֹנוֹ שֶׁל אָדָם בְּאָדָם, אוֹ שִׁלְטוֹנוֹ שֶׁל עַם בְּעַם?",האם כבר חלף מהעולם שלטונו של אדם באדם או שלטונו של עם בעם?,1,0
common_voice_he_39785442,זֶה מִקְרֶה שֶׁעָלוּל לִקְרוֹת לְכָל אָדָם בְּכָל עֵת,זה מקרה שעלול לקרות לכל אדם בכל עת.,1,0
common_voice_he_41066673,"מתנהלת בפומבי, בבית-משפט, בדלתיים פתוחות",מתנהלת בפומבי בבית משפט בדלתיים פתוחות.,0.8,0
common_voice_he_41616788,ראשון-לציון ואשדוד ישלמו פחות; ירושלים,"ראשון לציון ואשדוד ישלמו פחות, ירושלים.",0.8,0
common_voice_he_38196118,אֵינִי יוֹדַעַת מִשוּם מָה – קניתי אותו בְּאוֹתוֹ רֶגַע.,איני יודעת משום מה קניתי אותו באותו רגע.,0.7778,0
common_voice_he_40978560,"בן-גוריון עשה אותו מעל החאן"" הירושלמי""",בן גוריון עשה אותו מעל החאן הירושלמי.,0.6667,0
common_voice_he_40001947,המשמעות היא שאי-אפשר להכניס מצלמות לבית-ספר,המשמעות היא שאי אפשר להכניס מצלמות לבית ספר.,0.6667,0
common_voice_he_40001962,"ונופלים קסאמים"", והתשובה היא: ""קסאמים שמסאמים""",ונופלים קסאמים  והתשובה היא קסאמים שמסאמים.,0.6667,0
common_voice_he_39831379,"אני כשלעצמי רוצה לעבוד, ללמוד, להתקדם בשפה העברית","אני, כשלעצמי, רוצה לעבוד ללמוד להתקדם בשפה העברית.",0.625,0
common_voice_he_42487979,שילדים קטנים ובני-נוער צורכים סמים,שילדים קטנים ובני נוער צורכים סמים.,0.6,0
common_voice_he_41019419,"למשל, והבן-אדם בכלל מתעלם מהבקשה","למשל, והבן אדם בכלל מתעלם מהבקשה.",0.6,0
common_voice_he_39771115,יושב פה יושב-ראש ועדת הכלכלה,יושב פה יושב ראש ועדת הכלכלה.,0.6,0
common_voice_he_39785397,"בצפון-אפריקה, שמשתנים ממש לנגד עינינו",בצפון אפריקה שמשתנים ממש לנגד עינינו.,0.6,0
common_voice_he_39785514,להשקיע בכביש חוצה-שומרון זה בסדר,להשקיע בכביש חוצה שומרון זה בסדר.,0.6,0
common_voice_he_39937156,אי-אפשר לשחרר אסירים מהצד הזה,אי אפשר לשחרר אסירים מהצד הזה.,0.6,0
common_voice_he_39937282,"שבית-חולים ברזילי מסכן חיי אדם""",שבית חולים ברזילי מסכן חיי אדם.,0.6,0
common_voice_he_40001948,תוך אימוץ מדיניות כלכלית-חברתית צודקת,תוך אימוץ מדיניות כלכלית חברתית צודקת.,0.6,0
common_voice_he_41617133,"והעוזרים לידו, דורית ואג, סיגל קוגוט",והעוזרים לידו דורית ואג סיגל קוגוט.,0.5,0
common_voice_he_41605200,כי אי-אפשר לגמור עם; אי-אפשר להכניע עם שלם בכוח הכדורים וברצח ובהרג,"כי אי אפשר לגמור עם,  אי אפשר להכניע עם שלם בכוח הכדורים וברצח ובהרג.",0.5,0
common_voice_he_41605204,המנהיג הלובי מועמר קדאפי ידוע בעמדותיו,"המנהיג הלובי, מועמר קדאפי, ידוע בעמדותיו.",0.5,0
common_voice_he_39327184,יפה מאוד,יפה מאוד.,0.5,0
common_voice_he_38142088,אתה איתי.,אתה איתי,0.5,0
common_voice_he_39753131,לא בתל-אביב ולא בחיפה ולא בערים,לא בתל אביב ולא בחיפה ולא בערים.,0.5,0
common_voice_he_39753246,שעם אדם ממוצא פלסטיני אי-אפשר להתחתן,שעם אדם ממוצא פלסטיני אי אפשר להתחתן.,0.5,0
common_voice_he_39771319,"למעט פג אחד או יילוד אחד שהועבר לבית-החולים שניידר"" בפתח-תקווה""",למעט פג אחד או יילוד אחד שהועבר לבית החולים שניידר בפתח תקווה.,0.5,0
common_voice_he_39778673,"כמובן, למפלגות, וכמובן הגבלת שליטה זרה",כמובן למפלגות וכמובן הגבלת שליטה זרה.,0.5,0
common_voice_he_39778709,"כי, לצערי, העורף כבר נהפך לחזית",כי לצערי העורף כבר נהפך לחזית.,0.5,0
common_voice_he_39785447,מקום המבנה נבחר על-ידי עיריית ירושלים,מקום המבנה נבחר על ידי עיריית ירושלים.,0.5,0
common_voice_he_40001970,האיש יודע שאי-אפשר לעשות טרנספר לערבים,האיש יודע שאי אפשר לעשות טרנספר לערבים.,0.5,0
common_voice_he_41616770,בשדרות רחמנא ליצלן - אולי תיתנו להם פעם תשובה,"בשדרות, רחמנא ליצלן, אולי תיתנו להם פעם תשובה?",0.4444,0
common_voice_he_40630794,שבארצות-הברית למשל יש בחינה פעם אחת בשנה,שבארצות הברית למשל יש בחינה פעם אחת בשנה.,0.4286,0
common_voice_he_43503033,כחמשת אלפים פועלים מכפר-כנא ומהסביבה נזקקים לשירותיה,כחמשת אלפים פועלים מכפר כנא ומהסביבה נזקקים לשירותיה.,0.4286,0
common_voice_he_41605162,אולי באמת נתחיל מהנתונים הלא-קלים בנושא הזה,אולי באמת נתחיל מהנתונים הלא קלים בנושא הזה.,0.4286,0
common_voice_he_40001967,וביקשתי הצעה לסדר-היום לגבי המקרה של היום,וביקשתי הצעה לסדר היום לגבי המקרה של היום.,0.4286,0
common_voice_he_39350850,גם הורדו טיפוליו לרמת קופת-חולים,גם הורדו טיפוליו לרמת קופת חולים.,0.4,0
common_voice_he_40972202,שישולם לטובת הקרן לשיקום ים-המלח,שישולם לטובת הקרן לשיקום ים המלח.,0.4,0
common_voice_he_38078778,"אני הייתי שם, באמריקה שלך",אני הייתי שם באמריקה שלך.,0.4,0
common_voice_he_39753458,שנמצא בעבודה באפריקה או בארצות-הברית,שנמצא בעבודה באפריקה או בארצות הברית.,0.4,0
common_voice_he_39771209,נצטרך גם למצוא מסגרות חוץ-ביתיות,נצטרך גם למצוא מסגרות חוץ ביתיות.,0.4,0
common_voice_he_39778677,אנחנו אולי רגילים לנסיגה חד-צדדית,אנחנו אולי רגילים לנסיגה חד צדדית.,0.4,0
common_voice_he_39785444,היא לא יכולה להיכנס לבתי-הספר,היא לא יכולה להיכנס לבתי הספר.,0.4,0
common_voice_he_39918069,אני שונא את טיק טוק,אני שונא את טיק-טוק.,0.4,0
common_voice_he_41616760,מה ששמעתי ומה שקיבלנו - ההחלטה של בית-המשפט,מה ששמעתי ומה שקיבלנו – ההחלטה של בית המשפט.,0.375,0
common_voice_he_39771179,בצומת יגור למרגלות הר הכרמל יש משתלת פרחים,"בצומת יגור, למרגלות הר הכרמל, יש משתלת פרחים.",0.375,0
common_voice_he_39831345,אז אי-אפשר לקבל איזו הוראה שמגיעה מעבר לים,אז אי אפשר לקבל איזו הוראה שמגיעה מעבר לים.,0.375,0
common_voice_he_39937162,לגבי ההסתייגות העיקרית - אני חושב שאין מקום,"לגבי ההסתייגות העיקרית, אני חושב שאין מקום.",0.375,0
common_voice_he_42402440,הוא אמר: אני מחלק צ'קים פתוחים,הוא אמר אני מחלק צ'קים פתוחים.,0.3333,0
common_voice_he_41616557,יהדות התורה מציעה שינוי במדיניות הכלכלית-החברתית,יהדות התורה מציעה שינוי במדיניות הכלכלית החברתית.,0.3333,0
common_voice_he_40067778,נחקר במשך כשעה ובסיומה שוחרר לדרכו,"נחקר במשך כשעה, ובסיומה  שוחרר לדרכו.",0.3333,0
common_voice_he_39750877,אבל היות שהיו שינויים בסדר-היום הם היו חייבים לעזוב,אבל היות שהיו שינויים בסדר היום הם היו חייבים לעזוב.,0.3333,0
common_voice_he_40972200,הוא יגיד: אני נפגע תאונת דרכים,"הוא יגיד, אני נפגע תאונת דרכים.",0.3333,0
common_voice_he_40612852,"מאיפה הוא בא, מה תפיסת עולמו",מאיפה הוא בא? מה תפיסת עולמו?,0.3333,0
common_voice_he_40978609,ואם היה תורנו היום להגיש אי-אמון,ואם היה תורנו היום להגיש אי אמון?,0.3333,0
common_voice_he_40909699,"החשיבות ההיסטורית הלאומית, התרבותית, וגם החינוכית","החשיבות ההיסטורית הלאומית, התרבותית וגם החינוכית.",0.3333,0
common_voice_he_41616687,ואז יגידו: איך אפשר לצאת מעזה,ואז יגידו איך אפשר לצאת מעזה.,0.3333,0
common_voice_he_41616762,אז אני אומר: ההצעה היא הצעה,"אז אני אומר, ההצעה היא הצעה.",0.3333,0
common_voice_he_41605196,"כדי שבבוא העת, כאשר יתבררו העובדות",כדי שבבוא העת כאשר יתבררו העובדות.,0.3333,0
common_voice_he_41605213,בדרך כלל אומרים: מה המציעים מציעים,בדרך כלל אומרים מה המציעים מציעים.,0.3333,0
common_voice_he_39326830,"אני אסיים בעוד תוכנית סאטירית, ריאלית",אני אסיים בעוד תוכנית סאטירית ריאלית.,0.3333,0
common_voice_he_39642806,"מגיעים לתוצאות, ומגיעים לתוצאות טובות ומעולות",מגיעים לתוצאות ומגיעים לתוצאות טובות ומעולות.,0.3333,0
common_voice_he_39884492,הרי הוא צמח בשכונה ד' בבאר-שבע,הרי הוא צמח בשכונה ד' בבאר שבע.,0.3333,0
common_voice_he_38078772,כמה צעיר אתה!,כמה צעיר אתה.,0.3333,0
common_voice_he_38118878,רוצָה להיות חופשית?,רוצה להיות חופשית?,0.3333,0
common_voice_he_39753209,אני חוזר ואומר: לא מיכאל איתן,"אני חוזר ואומר, לא מיכאל איתן.",0.3333,0
common_voice_he_39753571,"נכים וכו', לא פוגעים בתגמולי המילואים",נכים וכו' לא פוגעים בתגמולי המילואים.,0.3333,0
common_voice_he_39753626,אז היית יכול לומר: שגיתי במקרו-כלכלה,אז היית יכול לומר שגיתי במקרו-כלכלה.,0.3333,0
common_voice_he_39753651,ואני יכול לתת לךְ הרבה דוגמאות,ואני יכול לתת לך הרבה דוגמאות.,0.3333,0
common_voice_he_39753657,ואז אולי האויב יבין שבכוח אי-אפשר,ואז אולי האויב יבין שבכוח אי אפשר.,0.3333,0
common_voice_he_39771113,"בעניין הזה, מדברים מדי כמה חודשים",בעניין הזה מדברים מדי כמה חודשים.,0.3333,0
common_voice_he_39771142,"עבירות שחיתות, אפשר לדגול בנושא הזה",עבירות שחיתות אפשר לדגול בנושא הזה.,0.3333,0
common_voice_he_39831341,מזהירים אותך: חייבים להבטיח מנגנון צמיחה,"מזהירים אותך, חייבים להבטיח מנגנון צמיחה.",0.3333,0
common_voice_he_39831378,לא יהיו תקלות בדרך - אבל בכל הטווח המקובל,"לא יהיו תקלות בדרך, אבל בכל הטווח המקובל.",0.3333,0
common_voice_he_39937268,"המצב שמצטייר הוא כאילו הצפון לא שייך להודנה"" משום-מה""",המצב שמצטייר הוא כאילו הצפון לא שייך להודנה משום מה.,0.3333,0
common_voice_he_39937278,"שהיא גדולה, ללא שום התחשבנויות קטנות",שהיא גדולה ללא שום התחשבנויות קטנות.,0.3333,0
common_voice_he_40001966,ההצבעה תיערך כך: מי שמצביע בעד,ההצבעה תיערך כך מי שמצביע בעד.,0.3333,0
common_voice_he_39642809,הדין של ירושלים לא ייחרץ על-ידי קבוצה פרובוקטיבית ומתוסכלת זו,הדין של ירושלים לא ייחרץ על ידי קבוצה פרובוקטיבית ומתוסכלת זו.,0.3,0
common_voice_he_39753656,לא נעשה כלום והנה עכשיו אני הולך לקדם ולעשות; לא,"לא נעשה כלום, והנה עכשיו אני הולך לקדם ולעשות.  לא!",0.3,0
common_voice_he_39771233,הוועדה המייעצת תקבע עורכי-דין הראויים ומתאימים לכהונה כבורר בבוררות חובה,הוועדה המייעצת תקבע עורכי דין הראויים  ומתאימים לכהונה כבורר בבוררות חובה.,0.3,0
common_voice_he_39897722,והערכים היקרים הם: דע מה למעלה ממך,והערכים היקרים הם דע מה למעלה ממך.,0.2857,0
common_voice_he_41616807,הוא אמר: אני לא משתתף במערכת הבחירות,"הוא אמר, אני לא משתתף במערכת הבחירות.",0.2857,0
common_voice_he_41486384,הבנקים אמרו: אנחנו מוכנים להסדיר זאת בעצמנו,"הבנקים אמרו, אנחנו מוכנים להסדיר זאת בעצמנו.",0.2857,0
common_voice_he_41605177,התגלו סגולותיו כמארג שנחשף אט-אט; יפי תוארו,"התגלו סגולותיו כמארג שנחשף אט-אט,  יפי תוארו.",0.2857,0
common_voice_he_41605211,אז ירושלים שואלת בצדק: למה לא אני,"אז ירושלים שואלת בצדק, למה לא אני?",0.2857,0
common_voice_he_39327027,אנחנו רוצים לאפשר לפלסטינים חופש פולחן בהר-הבית,אנחנו רוצים לאפשר לפלסטינים חופש פולחן בהר הבית.,0.2857,0
common_voice_he_39327139,מה טוב היה לי לו יכולתי להאמין,"מה טוב היה לי, לו יכולתי להאמין.",0.2857,0
common_voice_he_39753438,אנחנו עושים את זה היום כבר בבתי-החולים,אנחנו עושים את זה היום כבר בבתי החולים.,0.2857,0
common_voice_he_39785449,כשזה בכרטיס וזה מגוהץ אנחנו לא מרגישות,"כשזה בכרטיס וזה מגוהץ, אנחנו לא מרגישות.",0.2857,0
common_voice_he_41616643,אני לא אומר שלא - אבל אם אתה הולך לתהליך כזה,"אני לא אומר שלא, אבל אם אתה הולך לתהליך כזה...",0.2727,אני לא אומר שלא אבל אם אתה הולך לתהליך כזה
common_voice_he_40858579,מה ההבדל בין השטח הכבוש שנקרא אוניברסיטת תל-אביב,מה ההבדל בין השטח הכבוש שנקרא אוניברסיטת תל אביב?,0.25,0
common_voice_he_41019455,אמרתי את זה ואמרתי: תפתחו את הסרטים ותסתכלו,"אמרתי את זה ואמרתי, תפתחו את הסרטים ותסתכלו.",0.25,0
common_voice_he_40909697,אני מקווה שמהר מאוד ניתן תקווה לתושבי כפר-שלם,אני מקווה שמהר מאוד ניתן תקווה לתושבי כפר שלם.,0.25,0
common_voice_he_41616640,ואני אנסה להסביר גם למה: כמו שהוא אמר,"ואני אנסה להסביר גם למה, כמו שהוא אמר.",0.25,0
common_voice_he_38142084,לי אל תספר מעשיות!,לי אל תספר מעשיות.,0.25,0
common_voice_he_39753083,חמאת בוטנים זה אחלה,חמאת בוטנים זה אחלה!,0.25,0
common_voice_he_39753167,ראשי השירותים החשאיים של דרום-אפריקה היו הרבה יותר פרגמטיים מכל משטר האפרטהייד,ראשי השירותים החשאיים של דרום אפריקה היו  הרבה יותר פרגמטיים מכל משטר האפרטהייד.,0.25,0
common_voice_he_39753470,מרכזי חוסן קהילתיים בשדרות ובארבע מועצות אזוריות בעוטף-עזה,מרכזי חוסן קהילתיים בשדרות ובארבע מועצות אזוריות בעוטף עזה.,0.25,0
common_voice_he_39785410,אני מסתכל ואני מסרב להאמין: פרופסור שלמה אבינרי,"אני מסתכל ואני מסרב להאמין,  פרופסור שלמה אבינרי.",0.25,0
common_voice_he_39937164,"שבו הוא כותב כי המושג יהדות"" הוא אוניברסלי""",שבו הוא כותב כי המושג יהדות הוא אוניברסלי.,0.25,0
common_voice_he_43539844,זה מתפוצץ בפה ונימוח,זה מתפוצץ בפה ונימוח.,0.25,0
common_voice_he_39771230,"במהלך הבוררות הוכח כי חזן עסק בתקופת עבודתו בתיאטרון כרואה-חשבון עבור מספר לקוחות""",במהלך הבוררות הוכח כי חזן  עסק בתקופת עבודתו בתיאטרון כרואה חשבון עבור מספר לקוחות.,0.2308,0
common_voice_he_39778703,שמאפשרת את השבחת כוח ההוראה באמצעות שכר דיפרנציאלי - הדבר הזה נעדר משם,"שמאפשרת את השבחת כוח ההוראה באמצעות שכר דיפרנציאלי,  הדבר הזה נעדר משם.",0.2308,0
common_voice_he_40972203,אני חייב לומר לך: אני לא שייך למנזר השתקנים,"אני חייב לומר לך, אני לא שייך למנזר השתקנים.",0.2222,0
common_voice_he_39659797,שאנחנו עושים מאמץ כולל עכשיו לשלוט בתוכניות שנכנסות לבתי-הספר,שאנחנו עושים מאמץ כולל עכשיו לשלוט בתוכניות שנכנסות לבתי הספר.,0.2222,0
common_voice_he_39753492,המרכיב הכי חשוב הוא החוסן הלאומי - אחדות העם,המרכיב הכי חשוב הוא החוסן הלאומי – אחדות העם.,0.2222,0
common_voice_he_39785411,"בוחרים מלכתחילה שופט עליון שהשקפותיו הולמות"" זרם פוליטי מסוים""",בוחרים מלכתחילה שופט עליון שהשקפותיו הולמות זרם פוליטי מסוים.,0.2222,0
common_voice_he_39831342,זה נוסח התקנה: תושב הרשות הפלסטינית או ממוצא פלסטיני,זה נוסח התקנה תושב הרשות הפלסטינית או ממוצא פלסטיני.,0.2222,0
common_voice_he_39918055,ואנו עדים לגידול ניכר במספר המשתמשים בסמים בקרב בני-הנוער,ואנו עדים לגידול ניכר במספר המשתמשים בסמים בקרב בני הנוער.,0.2222,0
common_voice_he_39937181,ורק אחרי דיכוי הטרור ורק אחרי הפסקת אש כללית,"ורק אחרי דיכוי הטרור, ורק אחרי הפסקת אש כללית.",0.2222,0
common_voice_he_41486333,הארנונה בדימונה מוגזמת לעומת ירוחם,הארנונה בדימונה מוגזמת לעומת ירוחם.,0.2,0
common_voice_he_43512961,לא פחות ולא יותר: אני בקצבאות ילדים לא אקצץ לעולם,"לא פחות ולא יותר, אני בקצבאות ילדים לא אקצץ לעולם.",0.2,0
common_voice_he_41616584,היא יכולה לבקר מעשים; היא לא יכולה לבקר אנשים בהכללה,"היא יכולה לבקר מעשים,  היא לא יכולה לבקר אנשים בהכללה.",0.2,0
common_voice_he_39326818,ייתכן שאמונתי בכל זאת עמוקה,ייתכן שאמונתי בכל זאת עמוקה.,0.2,0
common_voice_he_39327123,"ועם כל זה היא כותבת מאמרים, ורק זה מעניין אותה!",ועם כל זה היא כותבת מאמרים ורק זה מעניין אותה.,0.2,0
common_voice_he_38118875,לכל התחלה יש הסוף שלה,לכל התחלה יש הסוף שלה.,0.2,0
common_voice_he_38142103,אבל אלה עדיין אינם בידינו,אבל אלה עדיין אינם בידינו.,0.2,0
common_voice_he_40001968,"ארגון לב לאחים"" פועל לחיזוק התודעה היהודית ולעידוד החינוך התורני""",ארגון לב לאחים פועל לחיזוק התודעה היהודית ולעידוד החינוך התורני.,0.2,0
common_voice_he_41486373,"הודיעה חברת האופנה הישראלית ""רנואר"" שקירל היא הפרזנטורית המוזיקלית החדשה שלהם",הודיעה חברת האופנה הישראלית רנואר שקירל היא  הפרזנטורית המוזיקלית החדשה שלהם.,0.1818,0
common_voice_he_39937205,זה החל בשבוע שעבר: שמעתי באמצעי התקשורת אנשים מתוך הבית הזה,"זה החל בשבוע שעבר,  שמעתי באמצעי התקשורת אנשים מתוך הבית הזה.",0.1818,0
common_voice_he_40977318,"העיר הפתוחה, אז, לפני כשנתיים ומשהו","העיר הפתוחה,  אז,  לפני כשנתיים ומשהו.",0.1667,0
common_voice_he_43281958,המספרים שהתפרסמו בתקשורת הם לא נכונים,המספרים שהתפרסמו בתקשורת הם לא נכונים.,0.1667,0
common_voice_he_41066670,גם החישובים מבחינה פיננסית זה צחוק,גם החישובים מבחינה פיננסית זה צחוק.,0.1667,0
common_voice_he_41869861,באמת תודה רבה לכל אלה ששותפים,באמת תודה רבה לכל אלה ששותפים.,0.1667,0
common_voice_he_41486334,לבין סטודנטים שלמדו כאן באוניברסיטאות בארץ,לבין סטודנטים שלמדו כאן באוניברסיטאות בארץ.,0.1667,0
common_voice_he_40909676,למה היא צריכה לגבות מהם אגרה,למה היא צריכה לגבות מהם אגרה?,0.1667,0
common_voice_he_39897723,"הם לא נעצרו, הם לא נשפטו","הם לא נעצרו, הם לא נשפטו.",0.1667,0
common_voice_he_38744644,ולכן כל הטכנולוגיה שאפשר להכניס ולהגביל,ולכן כל הטכנולוגיה שאפשר להכניס ולהגביל.,0.1667,0
common_voice_he_39750933,הרבה פעמים דובר על הנושא הזה,הרבה פעמים דובר על הנושא הזה.,0.1667,0
common_voice_he_40972199,"במפלגתי זה גרוע, בקדימה זה גרוע","במפלגתי זה גרוע,  בקדימה זה גרוע.",0.1667,0
common_voice_he_40137982,לא הפרו אמונים ולא קיבלו שוחד,לא הפרו אמונים ולא קיבלו שוחד.,0.1667,0
common_voice_he_43313118,ותוך חמש דקות זה מופיע ברדיו,ותוך חמש דקות זה מופיע ברדיו.,0.1667,0
common_voice_he_41019456,מה טוב חלקנו ומה נעים גורלנו,מה טוב חלקנו ומה נעים גורלנו?,0.1667,0
common_voice_he_43503050,"זה הנשיא שהטיף ומטיף, פעל ופועל","זה הנשיא שהטיף ומטיף, פעל ופועל.",0.1667,0
common_voice_he_43503051,הנושא הזה כבר עלה לפני שבועיים,הנושא הזה כבר עלה לפני שבועיים.,0.1667,0
common_voice_he_40978546,אני יודע מה זה כשהמשטרה חושדת,אני יודע מה זה כשהמשטרה חושדת.,0.1667,0
common_voice_he_40978567,הישיבה תתקיים ברציפות עד גמר ההצבעה,הישיבה תתקיים ברציפות עד גמר ההצבעה.,0.1667,0
common_voice_he_40978575,נכון שהחלק הזה הוא חלק מדאיג,נכון שהחלק הזה הוא חלק מדאיג.,0.1667,0
common_voice_he_40909691,ואני חושב שלעמוד פה ולהשמיץ בהכללה,ואני חושב שלעמוד פה ולהשמיץ בהכללה.,0.1667,0
common_voice_he_40909693,כי החייבת יכולה לעמוד בתשלומים שנפסקו,כי החייבת יכולה לעמוד בתשלומים שנפסקו.,0.1667,0
common_voice_he_40909694,גם בגין תלונה זו נפתחה חקירה,גם בגין תלונה זו נפתחה חקירה.,0.1667,0
common_voice_he_40909700,"לא תעסוקה, לא תקווה, לא חזון","לא תעסוקה, לא תקווה, לא חזון.",0.1667,0
common_voice_he_41616604,"לא רק יהודי, הוא ילד בשבילו","לא רק יהודי, הוא ילד בשבילו.",0.1667,0
