Filename,Reference Text,Transcribed Text,wer,wer c
common_voice_he_40909682,כי לפעמים הנזק הוא עצום והתביעות הן במיליונים,"כי לפעמים הנזק הוא עצום, והתהיות הן במיליונים.",0.375,1250
common_voice_he_39753056,"מבצע שלמה; מפקד סיירת מטכ""ל בעבר יושב כאן""","מבצע שלמה, מפקד סיירת מטכ״ל בעבר יושב כאן.",0.375,0
common_voice_he_41617137,זה אפשר לתקן כי זה לא מעשי שמים,"זה אפשר לתקן, כי זה לא מעשי שמיים.",0.25,0
common_voice_he_41019415,אפילו כאשר היתה ישיבה של ועדת התכנון בחיפה,אפילו כאשר הייתה ישיבה של ועדת התכנון בחיפה.,0.25,0
common_voice_he_43512945,היתה ישיבה פה בפגרת הקיץ לפני שנה וחצי,הייתה ישיבה פה בפגרת הקיץ לפני שנה וחצי.,0.25,0
common_voice_he_41616704,ויעקוב ויגיד מתי הם הלכו ולאיפה הם באו,ויעקב ויגיד מתי הם הלכו ולאיפה הם באו.,0.25,1250
common_voice_he_41486346,אקמול צינון עם קוקטיל של סטרואידים להורדת החום,אקמול צינון עם קוקטייל של סטרואידים להורדת החום.,0.25,1250
common_voice_he_41486355,"כי תמות נפשי עם פלשתים"" זה מול האויב""",כי תמות נפשי עם פלישתים זה מול האויב.,0.25,1250
common_voice_he_39753600,כמות הרכבים הממוגנים מספיקה לפעילות הגדוד ולביצוע משימותיו,כמות הרכבים המוגנים מספיקה לפעילות הגדוד ולביצוע משימותיו.,0.25,1250
common_voice_he_39778702,מייד עם כניסתי לתפקיד פעלתי בשלושה מישורים שונים:,מיד עם כניסתי לתפקיד פעלתי בשלושה מישורים שונים.,0.25,0
common_voice_he_43503067,האח הגדול היא תוכנית טלוויזיה פופולרית בערוץ שתיים,האח הגדול היא תוכנית טלוויזיה פופולרית בערוץ 2.,0.125,1250
common_voice_he_38118859,כולי תקווה שהאוזניות לא התקלקלו כשטבלו בכוס התה.,כולי תקווה שהאוזניות לא יתקלקלו כשטבלו בכוס התה.,0.125,0
common_voice_he_38146696,אף פעם לא ראיתי תוכי כל כך מאושר.,אף פעם לא ראיתי צוקי כל כך מאושר.,0.125,0
common_voice_he_38883686,כֹּל הַבְּרִיאִים מְהַלְּכִים כְּמוֹ קְפִיצִים מִתְמַתְּחִים וּמִתְכַּוְּצִים מִכְּאֵבֵי שְׁרִירִים.,"כל הבריאים מהלכים כמו קפיצים,  מתמתחים ומתכווצים מכאבי שרירים.",1,0
common_voice_he_39327091,"אֲפִילוּ לִי, שֶאֲנִי רַק חֲדָשִים אֲחָדִים חַיָה בְּצוּרָה זוֹ",אפילו לי שאני רק חודשים אחדים חיה בצורה זו.,1,1111
common_voice_he_39831352,אמרתי דווקא בית-חולים נהרייה ולא בית-חולים צפת,אמרתי דווקא בית חולים נהריה ולא בית חולים צפת.,0.8571,1111
common_voice_he_41616601,"בהם היפ הופ, רגאטון, רית'ם אנד בלוז ומוזיקה אלקטרונית","בהם היפ-הופ, רגיתון, ריתם אנד בלוז ומוזיקה אלקטרונית.",0.5556,3000
common_voice_he_40137981,יש הרבה מותגים של מכוניות בארץ. הונדה וסיטראון למשל,יש הרבה מותגים של מכוניות בארץ – הונדה וסיטואן למשל.,0.4444,0
common_voice_he_41617129,בריאת העולם היתה בזכות מידת החסד: עולם חסד ייבנה,בריאת העולם הייתה בזכות מידת החסד עולם חסד ייבנה.,0.3333,0
common_voice_he_40909689,ואני פונה לאריק שרון שיפנה לאהוד יתום ולגלעד ארדן,"ואני פונה לארק שרון, שיפנה לאהוד יתום ולגלעד ארדן.",0.3333,1111
common_voice_he_39778708,אני מקבל בכל לבי - יש כאן פגיעה לא מבוטלת,"אני מקבל בכל ליבי, יש כאן פגיעה לא מבוטלת.",0.3,1111
common_voice_he_40612866,אולם התגמולים לנזקקים ולנצרכים מותנים מטבע הדברים בהכנסות אחרות,אולם התמלוגים לנזקקים ולנצרכים מותנים מטבע הדברים בהכנסות אחרות.,0.2222,1111
common_voice_he_39326828,שאינם נחקקים באופן חוקתי ואשר לעתים קרובות הם הזויים,שאינם נחקקים באופן חוקתי ואשר לעיתים קרובות הם הזויים.,0.2222,1111
common_voice_he_39937165,הוא מייד הולך לקנות אופניים שהוא לא הצליח לקנות,הוא מיד הולך לקנות אופניים שהוא לא הצליח לקנות.,0.2222,0
common_voice_he_39937281,אני רוצה לשחרר שלושים אלף יחידות דיור מאושרות בחיפה,אני רוצה לשחרר 30 אלף יחידות דיור מאושרות בחיפה.,0.2222,1111
common_voice_he_40001958,אלא אני עומד גם מאחורי המלים שהוא לא ציטט,אלא אני עומד גם מאחורי המילים שהוא לא ציטט.,0.2222,1111
common_voice_he_41605164,לפני כשלושה שבועות אנחנו קיימנו דיון בוועדה למעמד האשה,לפני כשלושה שבועות אנחנו קיימנו דיון בוועדה למעמד האישה.,0.1111,1111
common_voice_he_38118866,אף פעם לא הבנתי למה שומשום יקר כל כך.,אף פעם לא הבנתי למה שונשון יקר כל כך.,0.1111,0
common_voice_he_39753068,מוטלת אחריות לא לתת לאנשים לשמוע הרהורים בין השיטין,מוטלת אחריות לא לתת לאנשים לשמוע הרהורים בין השיטים.,0.1111,1111
common_voice_he_39753590,הציר השני הוא אזרחים ואזרחיות שהם באמת מטפלים אלטרנטיבים,הציר השני הוא אזרחים ואזרחיות שהם באמת מטפלים אלטרנטיביים.,0.1111,1111
common_voice_he_38195452,אֵינִי מִתְכַּוֶונֶת לְהַבִּיעַ שֶבַּצוּרָה בָּה חַיַית עַד עַכְשָיו הָיִיתָ כָּבוּל,איני מתכוונת להביאה שבצורה בה חיית עד עכשיו  היית כבול.,1,1000
common_voice_he_39327185,רַק יוֹסִי’לִי עָמַד כְּשֶׁעֵינָיו פְּקוּחוֹת וּמַזְהִירוֹת וּפִיו אֵינוֹ פּוֹסֵק מִלְמַלְמֵל,רק יוסילי עמד כשעיניו פקוחות ומזהירות ופיו אינו פוסק מלמלמל.,1,0
common_voice_he_38085657,"הִיא שָׁתְקָה כְּמוֹ אֶבֶן, וְרַק עֵינֶיהָ הַגְּדוֹלוֹת וְהַדּוֹעֲכוֹת הִבִּיטוּ עָלַיי.","היא שתקה כמו אבן,  ורק עיניה הגדולות והדורחות הביטו עליי.",1,0
common_voice_he_39831344,"לְאַחַר תְּקוּפָה סוֹעֶרֶת, הֲרֵי מַה שֶׁנִּשְׁאַר אֵינוֹ אֶלָּא פָּרָשַׁת זִכְרוֹנוֹת","לאחר תקופה סוערת,  הרי מה שנשאר אינו אלא פרשת זיכרונות.",1,1000
common_voice_he_41605190,אני בעד חיזוק מזרח-ירושלים כולה בכל מקום שבו נימצא,אני בעד חיזוק מזרח ירושלים כולה בכל מקום שבו נמצא.,0.3333,1000
common_voice_he_39937168,פעם נוספת מתחת לאפנו מתחוללת בדרום שוב איזה מיני-מלחמה,פעם נוספת מתחת לאפינו מתחוללת בדרום שוב איזה מיני מלחמה.,0.3333,1000
common_voice_he_39753545,שבעיני מיליארד מוסלמים הוא מנהיג וגיבור כמו צלאח א-דין,שבעיני מיליארד מוסלמים הוא מנהיג וגיבור כמו סלאח א-דין.,0.2222,1000
common_voice_he_39771111,ובגלל זה לא נגענו בקצבאות הזיקנה ולא נגענו בקצבאות הנכים,ובגלל זה לא נגענו בקצבאות הזקנה ולא נגענו בקצבאות הנכים.,0.2,1000
common_voice_he_39771305,לא הבשיל אז התהליך עקב העדר נכונות מקבילה בצד השני,לא הבשיל אז התהליך עקב היעדר נכונות מקבילה בצד השני.,0.2,1000
common_voice_he_41605155,אפילו האויב כבר לא מבוצר מאחורי שלושה קווי הגנה סוריים,אפילו האויב כבר לא מבוצר מאחורי שלושה קווי הגנה סורים.,0.1,1000
common_voice_he_39327216,"אִם הַשְׁעָרָתוֹ שֶׁל הַנּוֹרְוֶגִי נְכוֹנָה הִיא, הֲרֵינִי מַצִּיעַ אֶת עַצְמִי לְעֶזְרָתְךָ.","אם השערתו של הנורבגי נכונה היא,  הריני מציע את עצמי לעזרתך.",1,0
common_voice_he_38142101,"יֵשׁ לוֹ רַק מַאֲפִיָּיה וְתַנּוּר חַם, סַל גָּדוֹל וְשָׁלוֹשׁ שְׁעוֹת מְנוּחָה","יש לו רק מאפייה ותנור חם,  סל גדול ושלוש שעות מלוכה.",1,909
common_voice_he_39771199,"אַתֶּם הָעוֹבְדִים, הַקּוֹדְחִים, הַקְּרוּעִים, הַמִּלְּיוֹנִים, אֲשֶׁר מִצְחֲכֶם קוֹרֵן אוֹר יְגִיעָה וְעָמָל","אתם העובדים, הקודחים, הקרועים, המיליונים,  אשר מצחכם קורן אור, יגיעה ועמל.",1,909
common_voice_he_39327152,"מובן שלא בין יהודים כאלה: חופשיים, עמלים, שקטים, ולדעתי גם מאושרים.","מובן שלא בין יהודים כאלה,  חופשים,  עמלים,  שקטים ולדעתי גם מאושרים.",0.2727,0
common_voice_he_39327041,מִן טְבֶרְיָה הָעִיר וְעַד לַדֶּרֶךְ הַצְּדָדִית הַמִּתְרוֹמֶמֶת לְבֵין הֶהָרִים שֶׁבְּתוֹכָם שֶׁכֵּן הַכְּפָר.,מן טבריה העיר ועד לדרך הצדדית המתרוממת  לבין הערים שבתוכם שכן הכפר.,1,0
common_voice_he_38146695,"הִיא הָיְתָה נִרְאֵית כְּיַלְדָּה בַּת תֵּשַׁע, שֶׁזֶּה עַתָּה עָזְבָה אֶת בֵּית הַחוֹלִים.","היא הייתה נראית כילדה בת תשע,  שזה עתה עזבה את בית החולים.",1,0
common_voice_he_40001950,"קבוצת סיעת האיחוד הלאומי וקבוצת סיעת מרצ לפרק יב: חשמל לא נתקבלה""",קבוצת סיעת האיחוד הלאומי וקבוצת סיעת מרץ לפרק יב חשמל לא נתקבלה.,0.25,833
common_voice_he_43281936,ליד כיכר רבין יש את המקום עם הסושי הכי טוב שאכלתי בחיים,ליד כיכר רבין יש את המקום עם הסושה הכי טוב שאכלתי בחיים.,0.1667,833
common_voice_he_39327005,הרי אין דוגמה אחת בעולם לכך שבזמן מיתון הורדת מסים יצרה צמיחה,הרי אין דוגמה אחת בעולם לכך שבזמן מיתון הורדת מיסים יצרה צמיחה.,0.1667,0
common_voice_he_38142090,לך אל החברה שיחזירו לך דמי כרטיס האונייה ושוב למקום שבאת משם,לך אל החברה שהחזירו לך דמי כרטיס האונייה ושוב למקום שבאת משם.,0.1667,833
common_voice_he_39785418,אגיד הסתייגות אחת בפתח תשובתי: תשובתי אינה כוללת את הנושא שהעלית אתה,אגיד הסתייגות אחת בפתח תשובתי.  תשובתי אינה כוללת את הנושא שהעלית עתה.,0.1667,0
common_voice_he_39753166,והם הכול-יכולים והם רשאים לעשות מה שהם רוצים בסילואן ובכלל בעיר ירושלים,והם הכל יכולים והם רשאים לעשות מה שהם רוצים בסילואן ובכלל בעיר ירושלים.,0.25,0
common_voice_he_39753490,פנו אלי סטודנטים מירושלים בשאלה: מדוע אנחנו לא מקבלים את ההנחה המגיעה לנו בארנונה,פנו אליי סטודנטים מירושלים בשאלה מדוע אנחנו  לא מקבלים את ההנחה המגיעה לנו בארנונה.,0.2143,714
common_voice_he_41605180,אנו מזהירים מפני הסכנה שבחפירות המתבצעות לאחרונה מתחת למסגד אל-אקצא לאורך רשת מנהרות,אנו מזהירים מפני הסכנה שבחפירות המתבצעת לאחרונה  מתחת למסגד אל-אקצא לאורך רשת מנהרות.,0.1538,714
common_voice_he_39771198,המגמה הקיימת היא לשחרר מוצרים מפיקוח מחירים מייד כאשר אפשר לעשות כן מבחינה כלכלית,המגמה הקיימת היא לשחרר מוצרים מפיקוח מחירים  מיד כאשר אפשר לעשות כן מבחינה כלכלית.,0.1429,0
common_voice_he_39937161,הפעלת הסמכויות המינהליות באכיפת התקן הביאה לשינוי דרסטי בהתייחסות הרשויות לתוצאות הבדיקה שנעשתה מטעמנו,הפעלת הסמכויות המנהליות באכיפת התקן הביאה לשינוי דרסטי  בהתייחסות הרשויות לתוצאות הבדיקה שנעשתה מטעמנו.,0.1429,714
common_voice_he_43503055,נערכו השתלמויות מורים לשיפור איכות ההוראה ולהטמעת תוכניות לימודים וחומרי למידה עתירי טכנולוגיות עיליות,נערכו השתלמויות מורים לשיפור איכות ההוראה ולהטמעת  תוכניות לימודים וחומרי למידה עתירי טכנולוגיות ידעיות.,0.0714,714
common_voice_he_39785413,גברים חושבים הרבה יותר על האימפריה הרומית מנשים. זה לא הוכחה לאינטליגנציה גבוהה מצדם,גברים חושבים הרבה יותר על האימפריה הרומית מנשים.  זה לא הוכחה לאינטליגנציה גבוהה מצידם.,0.0714,גברים חושבים הרבה יותר על האימפריה הרומית מנשים זה לא הוכחה לאינטליגנציה גבוהה מצידם
common_voice_he_39327200,"וּבְעֵת רַחֲמִים, בֵּין-הַשְּׁמָשׁוֹת",ובעת רחמים בין השמשות,1.3333,0
common_voice_he_41616556,קווי רכבת כמו אשקלון-שדרות-באר-שבע,"קווי רכבת כמו אשקלון, שדרות, באר שבע",1,0
common_voice_he_38283249,הַהַכְנָסָה הַיּוֹתֵר גְּדוֹלָה הִיא מִמְּכִירַת בּוּלִים.,ההכנסה היותר גדולה היא ממכירת בולים.,1,0
common_voice_he_38283250,"אָהַבְתִּי אֶתְכֶם, סַפָּנִים, הַיּוֹצְאִים בְּשִׁיר זֶמֶר תָּמִים","אהבתי אתכם, ספנים היוצאים בשיר זמר תמים.",1,0
common_voice_he_38283253,"אֲנָשִׁים יָצְאוּ מִכָּאן, בִּמְקוֹם סְפּוֹרְטָאִים, בְּעָלֵי חֶשְׁבּוֹן",אנשים יצאו מכאן במקום ספורטאים בעלי חשבון.,1,0
common_voice_he_38883184,עַכְשָׁיו הִיא הִתְחִילָה לִתְפּוֹס מִפְּנֵי מָה הִסְתַּלְּקוּ לָהֶן כָּל שְׁאָר הָעֻובְדּוֹת,עכשיו היא התחילה לתפוס מפני מה הסתלקו להן כל שאר העובדות.,1,0
common_voice_he_38883186,"עָשִׂיתִי כֶּסֶף רַב, וְהִנֵּה, בְּאַחַד הַיָּמִים הָלַךְ כָּל הַכֶּסֶף לַעֲזָאזֵל בְּעֵסֶק בִּישׁ.","עשיתי כסף רב,  והנה באחד הימים הלך כל הכסף לעזאזל בעסק ביש.",1,0
common_voice_he_38094978,אָרְכוּ הַלֵּילוֹת וְקָצְרוּ הַיָּמִים,ארכו הלילות וקצרו הימים.,1,0
common_voice_he_38094981,הַמּוֹרִים לוֹקְחִים כִּרְכָּרוֹת וְנוֹסְעִים לִקְרָאתָם.,המורים לוקחים כרכרות ונוסעים לקראתם.,1,0
common_voice_he_38883685,בְּיוֹם בָּהִיר יָפֶה יָצָאנוּ לְטִיּוּל,ביום בהיר יפה יצאנו לטיול.,1,0
common_voice_he_38883687,עָשָׁן הֵחֵל לְהַחֲנִיקֵנוּ.,עשן החל להחניקנו.,1,0
common_voice_he_38195450,"סַפֵּר, יוֹסִי, אָמַר אֲבִישַׁי","ספר, יוסי, אמר אבישי.",1,0
common_voice_he_38196114,אֵין חֶדֶר פָּנוּי בַּמַּחֲנֶה.,אין חדר פנוי במחנה.,1,0
common_voice_he_38196119,לוּ הָיוּ אַנְשֵׁי הַקְּבוּצָה אוֹכְלִים כָּמוֹהוּ,לו היו אנשי הקבוצה אוכלים כמוהו.,1,0
common_voice_he_38196126,וּכְשֶׁקָּרָאתִי אֶת הָעִיתּוֹן נִמְלָא לִיבִּי יֵיאוּשׁ.,וכשקראתי את העיתון נמלא ליבי ייאוש.,1,0
common_voice_he_41616637,"אוֹמְרִים, יֵשׁ בָּעוֹלָם נְעוּרִים – הֵיכָן נְעוּרַי?","אומרים יש בעולם נעורים, היכן נעורי?",1,0
common_voice_he_41616743,אוּלַי הִיא כּוֹלֶלֶת הֲמוֹן נְטָפִים,אולי היא כוללת המון נטפים.,1,0
common_voice_he_41616808,לָמָּה שֶׁלֹּא תֵּלֵךְ לִישׁוֹן?,למה שלא תלך לישון?,1,0
common_voice_he_41486347,"לוחשים, אומרים: הקואליציה, סיעה, קואליציה, סיעה",לוחשים אומרים הקואליציה סיעה קואליציה סיעה.,1,0
common_voice_he_41486362,עֲטֶ֣רֶת זְ֭קֵנִים בְּנֵ֣י בָנִ֑ים וְתִפְאֶ֖רֶת בָּנִ֣ים אֲבוֹתָֽם׃,"עטרת זקנים בני בנים, ותפארת בנים אבותם.",1,0
common_voice_he_41605178,סֵמֶל אֵינוֹ זָר לַתְּבוּנָה,סמל אינו זר לתבונה.,1,0
common_voice_he_39326813,"אֶפְרַיִם, רוֹצֶה אֲנִי לְהַגִּיד מַשֶּׁהוּ.","אפרים, רוצה אני להגיד משהו.",1,0
common_voice_he_39326816,לֹא יָדַעְנוּ מָה לַעֲשׂוֹת.,לא ידענו מה לעשות.,1,0
common_voice_he_39326817,"רָאִיתִי שֶׁהַכֹּל חַי וְצוֹהֵל לִקְרַאת הַיּוֹם הַזֶּה, הַיּוֹם הָאֶחָד בְּכָל הַחוֹרֶף","ראיתי שהכל חי וצוהל לקראת היום הזה,  היום האחד בכל החורף.",1,0
common_voice_he_39326862,"זָר אֲנִי לָאֲנָשִׁים, אוּלָם קָרוֹב אֲנִי לָאֲדָמָה.","זר אני לאנשים, אולם קרוב אני לאדמה.",1,0
common_voice_he_39326864,תְּנוּ לוֹ לְדַבֵּר לְכָל הָרוּחוֹת,תנו לו לדבר לכל הרוחות.,1,0
common_voice_he_39327038,אַךְ אִישׁ לֹא יַפְנֶה מֶבָּטוֹ אֶל עֶבְרִי.,אך איש לא יפנה מבטו אל עברי.,1,0
common_voice_he_39327040,כָּל שָׁנָה הֵבִיאָה לוֹ פְּרָחִים יְפֵהפִיִּים.,כל שנה הביאה לו פרחים יפהפיים.,1,0
common_voice_he_39327063,זוֹרְחִים עוֹד כּוֹכָבִים,זורחים עוד כוכבים.,1,0
common_voice_he_39327066,"פִּתְאוֹם הִתְעוֹרֵר, כֻּולּוֹ נִפְחָד, כְּשֶׁיָּדוֹ הָאַחַת מְגָרֶדֶת אֶת הֶחָזֶה וְשׁוֹאֵל: מָה הַשָּׁעָה?","פתאום התעורר כולו נפחד כשידו האחת מגרדת את החזה ושואל,  מה השעה?",1,0
common_voice_he_39327068,"אֵין גּוֹיִים בְּאֶרֶץ יִשְׂרָאֵל, אָמַר אַמְנוֹן, ""וְאֵין אָנוּ מְפַחֲדִים מִפְּנֵי גּוֹיִים.""","אין גויים בארץ ישראל, אמר אמנון,  ואין אנו מפחדים מפני גויים.",1,0
common_voice_he_39327096,יֵשׁ חֲכָמִים הַנִּשְׁמָרִים מִסְּמָלִים,יש חכמים הנשמרים מסמלים.,1,0
common_voice_he_39327099,נִכְנַסְנוּ לַמִּסְעָדָה וְאָכַלְנוּ שָׁם אֲרוּחַת בּוֹקֶר.,נכנסנו למסעדה ואכלנו שם ארוחת בוקר.,1,0
common_voice_he_39327100,לְדָנִי קָרְאוּ דִּין דִּין דָּנִי,לדני קראו דין דין דני.,1,0
common_voice_he_39327103,הַמּוֹרִים יוֹצְאִים מִחוּץ לָעִיר וּמְחַפְּשִׂים.,המורים יוצאים מחוץ לעיר ומחפשים.,1,0
common_voice_he_39327105,הוּא פָּגַע רַק בַּבָּשָׂר וְהָעוֹר אֲשֶׁר עָלָיו מוּצָק הָיָה,"הוא פגע רק בבשר, והעור אשר עליו מוצק היה.",1,0
common_voice_he_39327119,כָּל הַמַּחְלָקוֹת חַיָּיבוֹת לָגֶשֶׁת בְּמֶרֶץ לָעֲבוֹדָה וּלְהִשְׁתַּדֵּל בְּכָל הַכּוֹחוֹת לְהַגְדִּיל אֶת חֶלְקָן.,כל המחלקות חייבות לגשת במרץ לעבודה ולהשתדל בכל הכוחות להגדיל את חלקן.,1,0
common_voice_he_39327120,"בִּנְשִׁימָה אַחַת, כְּמוֹ פָּרָה",בנשימה אחת כמו פרה.,1,0
common_voice_he_39327121,סִיפְּרָה שֶאַתָה וּבַת דוֹדְךָ רוֹצִים לִנְסוֹעַ הַבַּיְתָה.,סיפרה שאתה ובת דודך רוצים לנסוע הביתה.,1,0
common_voice_he_39327126,מָצָאנוּ אֶת הַלּוּחַ,מצאנו את הלוח.,1,0
common_voice_he_39327137,"אֵינִי רוֹצֶה, אֵינִי יָכוֹל","איני רוצה, איני יכול.",1,0
common_voice_he_39327151,"הָאָרֶץ, שֶׁעַל יְדֵי חַיִּים כָּאֵלֶּה עוֹמֶדֶת לְהִיבָּנוֹת.",הארץ שעל ידי חיים כאלה עומדת להיבנות.,1,0
common_voice_he_39327196,וּבֶאֱמֶת הָלַכְנוּ וְלֹא יָדַעְנוּ לְאָן.,ובאמת הלכנו ולא ידענו לאן.,1,0
common_voice_he_39327215,"אוֹמְרִים, אַהֲבָה יֵשׁ בָּעוֹלָם – מַה-זֹּאת אַהֲבָה?",אומרים אהבה יש בעולם.  מה זאת אהבה?,1,0
common_voice_he_39327217,אִם לֹא גָמַלְתָּ עָלַי אֶת הַחֶסֶד,"אם לא גמלת עלי את החסד,",1,0
common_voice_he_38078769,רַק הַלְּבָנָה וְהַכּוֹכָבִים הֵאִירוּ אֶת הַדֶּרֶךְ.,רק הלבנה והכוכבים האירו את הדרך.,1,0
common_voice_he_38078770,אַף אִישׁ לֹא זָז מִמְּקוֹמוֹ.,אף איש לא זז ממקומו.,1,0
common_voice_he_38085652,נִלְחֲמוּ בִּי הַיֵּצֶר הַטּוֹב וְהַיֵּצֶר הָרַע.,נלחמו בי היצר הטוב והיצר הרע.,1,0
common_voice_he_38104823,סַפֵּר וּכְתוֹב עַל הַנַעֲשֶׂה אֶצְלְךָ בַּכְּלָל וּבִפְרָט,ספר וכתוב על הנעשה אצלך בכלל ובפרט.,1,0
common_voice_he_38142066,וְעַכְשָיו כְּבָר מִתְקָרְבִים לַסוֹף.,ועכשיו כבר מתקרבים לסוף.,1,0
common_voice_he_38142074,"בָּא הַמּוֹרֶה וְאָמַר, כִּי הַמַּחְלָקָה יָצְאָה לְטִיּוּל עִם הַמּוֹרֶה.",בא המורה ואמר כי המחלקה יצאה לטיול עם המורה.,1,0
common_voice_he_38142085,אֵין הוּא זוֹחֵל כִּי אִם מְרַקֵּד,אין הוא זוחל כי אם מרקד.,1,0
common_voice_he_38142086,בָּרוּר שֶׁבִּדְרָכִים רְגִילוֹת לֹא נַשִּׂיג אֶת הָאֶמְצָעִים לַחֲפִירַת בְּאֵר,ברור שבדרכים רגילות  לא נשיג את האמצעים לחפירת באר.,1,0
common_voice_he_38142096,"לֹא תַצְמִיחַ לֹא דֶשֶׁא, לֹא עֵץ","לא תצמיח,  לא דשא, לא עץ.",1,0
common_voice_he_38146667,עֵינָיו הִבְרִיקוּ וּלְשׁוֹנוֹ הִסְתַּבְּכָה בְּפִיו.,עיניו הבריקו  ולשונו הסתבכה בפיו.,1,0
common_voice_he_38146703,אוּלַי יֵשׁ לוֹ מַה לְּהַגִּיד!,אולי יש לו מה להגיד.,1,0
common_voice_he_39753165,רַבּוֹת הָיוּ הָאַכְזָבוֹת,רבות היו האכזבות.,1,0
common_voice_he_39753244,הַנָּשִׁים כְּבָר הָיוּ מְלֵאוֹת יְלָדִים חֲדָשִׁים.,הנשים כבר היו מלאות ילדים חדשים.,1,0
common_voice_he_39753480,"הַמִכְתָב נִכְתָב, כְּפִי שֶכַּתָבָתִי בְּרֹאשוֹ, בְּשָעָה כָּזוֹ מְאוּחֶרֶת","המכתב נכתב, כפי שכתבתי בראשו, בשעה כזו מאוחרת.",1,0
